{
  "spec": "agent-hook-unity/0.1",
  "event_id": "36c2b982-1d4c-4dc2-ae5b-a65139601741",
  "hookSpecificOutput": {
    "hookEventName": "PreToolUse",
    "permissionDecision": "deny",
    "permissionDecisionReason": "Destructive commands are blocked."
  },
  "extensions": {
    "com.example.policy": {
      "rule_id": "destructive-command"
    }
  }
}
