{
  "spec": "agent-hook-unity/0.1",
  "event_id": "36c2b982-1d4c-4dc2-ae5b-a65139601741",
  "decision": "allow",
  "reason": "Approved by security administrator Alice.",
  "extensions": {
    "sec.enterprise.hitl": {
      "challenge_id": "ch_slack_prod_99182",
      "approval_grant_token": "agt_eyJhbGciOiJFZERTQ...",
      "approved_by": "alice.security.lead@example.com",
      "approved_at": 1773726500,
      "bound_tool_hash": "sha256:e3b0c44298fc1c149afbf4c8996fb92427ae41e4649b934ca495991b7852b855"
    }
  }
}
