{
  "spec": "agent-hook-unity/0.1",
  "event_id": "b3e040aa-f94d-446a-8b83-a9ea44047a01",
  "decision": "allow",
  "hookSpecificOutput": {
    "hookEventName": "AfterModelResponse",
    "updatedResponse": {
      "content": "Here is the sanitized architecture report without internal IPs [REDACTED]."
    }
  }
}
