{
  "spec": "agent-hook-unity/0.1",
  "event_id": "36c2b982-1d4c-4dc2-ae5b-a65139601741",
  "decision": "ask",
  "reason": "Administrative privileges required to access production database.",
  "extensions": {
    "sec.enterprise.hitl": {
      "mode": "async_suspended",
      "challenge_id": "ch_slack_prod_99182",
      "resumption_channel": "slack://security-operations",
      "expires_at": 1773729900,
      "escalation_policy": "require_manager_approval"
    }
  }
}
