{
  "spec": "agent-hook-unity/0.1",
  "event_id": "b4e2d194-3f6e-4fe4-8f7d-c87351823963",
  "decision": "allow",
  "extensions": {
    "sec.enterprise.degradation": {
      "profile_version": "1.0",
      "mode": "bounded_open",
      "applicable_gates": [
        "PreToolUse",
        "PreNetworkAccess",
        "PreMemoryWrite",
        "SubagentStart"
      ],
      "applicable_failures": [
        "timeout",
        "transport_error",
        "http_server_error",
        "malformed_response",
        "native_validation_failure"
      ],
      "bounded_open_policy": {
        "max_consecutive_failures": 3,
        "window_seconds": 60,
        "cooldown_seconds": 300,
        "on_exhausted": "fail_closed"
      },
      "audit_alert": true
    }
  }
}
